{
  "schemaVersion": "1.0",
  "workbookId": "acct-fixture-1",
  "meta": {
    "title": "Accounting Fixture",
    "author": "test",
    "createdAt": "2025-01-01T00:00:00.000Z",
    "modifiedAt": "2025-01-01T00:00:00.000Z"
  },
  "sheets": [
    {
      "id": "ledger",
      "name": "Ledger",
      "visible": true,
      "grid": { "rowCount": 200, "colCount": 10 },
      "cells": {
        "A1": { "raw": "Date", "dataType": "string" },
        "B1": { "raw": "Account", "dataType": "string" },
        "C1": { "raw": "Debit", "dataType": "number" },
        "D1": { "raw": "Credit", "dataType": "number" },
        "E1": { "raw": "Description", "dataType": "string" },
        "A2": { "raw": "2025-01-02", "dataType": "string" },
        "B2": { "raw": "Cash", "dataType": "string" },
        "C2": { "raw": 1000, "dataType": "number" },
        "D2": { "raw": 0, "dataType": "number" },
        "E2": { "raw": "Initial capital", "dataType": "string" },
        "A3": { "raw": "2025-01-03", "dataType": "string" },
        "B3": { "raw": "Revenue", "dataType": "string" },
        "C3": { "raw": 0, "dataType": "number" },
        "D3": { "raw": 500, "dataType": "number" },
        "E3": { "raw": "Product sale", "dataType": "string" },
        "A4": { "raw": "2025-01-04", "dataType": "string" },
        "B4": { "raw": "COGS", "dataType": "string" },
        "C4": { "raw": 200, "dataType": "number" },
        "D4": { "raw": 0, "dataType": "number" },
        "E4": { "raw": "Inventory cost", "dataType": "string" },
        "A5": { "raw": "2025-01-05", "dataType": "string" },
        "B5": { "raw": "Expenses", "dataType": "string" },
        "C5": { "raw": 150, "dataType": "number" },
        "D5": { "raw": 0, "dataType": "number" },
        "E5": { "raw": "Office supplies", "dataType": "string" },
        "A6": { "raw": "2025-02-01", "dataType": "string" },
        "B6": { "raw": "Accounts Receivable", "dataType": "string" },
        "C6": { "raw": 0, "dataType": "number" },
        "D6": { "raw": 300, "dataType": "number" },
        "E6": { "raw": "Invoice note", "dataType": "string" },
        "A7": { "raw": "2025-02-02", "dataType": "string" },
        "B7": { "raw": "Accounts Payable", "dataType": "string" },
        "C7": { "raw": 0, "dataType": "number" },
        "D7": { "raw": 100, "dataType": "number" },
        "E7": { "raw": "Supplier credit", "dataType": "string" },
        "A8": { "raw": "2025-03-01", "dataType": "string" },
        "B8": { "raw": "Inventory", "dataType": "string" },
        "C8": { "raw": 500, "dataType": "number" },
        "D8": { "raw": 0, "dataType": "number" },
        "E8": { "raw": "Purchase inventory", "dataType": "string" },
  "A9": { "raw": "2025-03-05", "dataType": "string" },
  "B9": { "raw": "Equity", "dataType": "string" },
  "C9": { "raw": 0, "dataType": "number" },
  "D9": { "raw": 950, "dataType": "number" },
  "E9": { "raw": "Capital injection to balance ledger", "dataType": "string" }
      }
    },
    {
      "id": "trial",
      "name": "TrialBalance",
      "visible": true,
      "grid": { "rowCount": 50, "colCount": 10 },
      "cells": {
        "A1": { "raw": "Account", "dataType": "string" },
        "B1": { "raw": "Debit", "dataType": "number" },
        "C1": { "raw": "Credit", "dataType": "number" },
        "A2": { "raw": "Cash", "dataType": "string" },
        "A3": { "raw": "Accounts Receivable", "dataType": "string" },
        "A4": { "raw": "Inventory", "dataType": "string" },
        "A5": { "raw": "Accounts Payable", "dataType": "string" },
        "A6": { "raw": "Revenue", "dataType": "string" },
        "A7": { "raw": "COGS", "dataType": "string" },
        "A8": { "raw": "Expenses", "dataType": "string" },
        "A9": { "raw": "Equity", "dataType": "string" },
        "B2": { "formula": "=SUMIFS(Ledger!C:C,Ledger!B:B,\"Cash\")" },
        "C2": { "formula": "=SUMIFS(Ledger!D:D,Ledger!B:B,\"Cash\")" },
        "B3": { "formula": "=SUMIFS(Ledger!C:C,Ledger!B:B,\"Accounts Receivable\")" },
        "C3": { "formula": "=SUMIFS(Ledger!D:D,Ledger!B:B,\"Accounts Receivable\")" },
        "B4": { "formula": "=SUMIFS(Ledger!C:C,Ledger!B:B,\"Inventory\")" },
        "C4": { "formula": "=SUMIFS(Ledger!D:D,Ledger!B:B,\"Inventory\")" },
        "B5": { "formula": "=SUMIFS(Ledger!C:C,Ledger!B:B,\"Accounts Payable\")" },
        "C5": { "formula": "=SUMIFS(Ledger!D:D,Ledger!B:B,\"Accounts Payable\")" },
        "B6": { "formula": "=SUMIFS(Ledger!C:C,Ledger!B:B,\"Revenue\")" },
        "C6": { "formula": "=SUMIFS(Ledger!D:D,Ledger!B:B,\"Revenue\")" },
        "B7": { "formula": "=SUMIFS(Ledger!C:C,Ledger!B:B,\"COGS\")" },
        "C7": { "formula": "=SUMIFS(Ledger!D:D,Ledger!B:B,\"COGS\")" },
        "B8": { "formula": "=SUMIFS(Ledger!C:C,Ledger!B:B,\"Expenses\")" },
        "C8": { "formula": "=SUMIFS(Ledger!D:D,Ledger!B:B,\"Expenses\")" },
        "B9": { "formula": "=SUMIFS(Ledger!C:C,Ledger!B:B,\"Equity\")" },
        "C9": { "formula": "=SUMIFS(Ledger!D:D,Ledger!B:B,\"Equity\")" },
        "B11": { "formula": "=SUM(B2:B9)" },
        "C11": { "formula": "=SUM(C2:C9)" }
      }
    },
    {
      "id": "income",
      "name": "IncomeStatement",
      "visible": true,
      "grid": { "rowCount": 50, "colCount": 10 },
      "cells": {
        "A1": { "raw": "Item", "dataType": "string" },
        "B1": { "raw": "Amount", "dataType": "number" },
        "A2": { "raw": "Revenue", "dataType": "string" },
        "A3": { "raw": "COGS", "dataType": "string" },
        "A4": { "raw": "Gross Profit", "dataType": "string" },
        "A5": { "raw": "Operating Expenses", "dataType": "string" },
        "A6": { "raw": "Net Income", "dataType": "string" },
        "B2": { "formula": "=TrialBalance!C6 - TrialBalance!B6" },
        "B3": { "formula": "=TrialBalance!B7 - TrialBalance!C7" },
        "B4": { "formula": "=B2 - B3" },
        "B5": { "formula": "=TrialBalance!B8 - TrialBalance!C8" },
        "B6": { "formula": "=B4 - B5" }
      }
    }
  ]
}
